{
  "siteId": "javalambre-observatory-road",
  "source": "era5-single-levels-timeseries",
  "climateNormal": {
    "startYear": 1991,
    "endYear": 2020
  },
  "requestedPoint": [
    40.04,
    -1.01
  ],
  "gridPoint": [
    40,
    -1
  ],
  "gridDistanceKm": 4.529,
  "retrievedAt": "2026-09-17T11:24:47.535012Z",
  "precipitationConvention": "hourly-accumulation-ending-at-valid-time-metres-to-mm",
  "months": [
    {
      "month": 1,
      "astronomicalHourCount": 10230,
      "nightCount": 930,
      "clearHourProbability": 0.329032,
      "goodHourProbability": 0.416813,
      "overcastHourProbability": 0.394526,
      "clearNightProbability": 0.424731,
      "goodNightProbability": 0.513978,
      "wetNightHourProbability": 0.076735,
      "dewRiskProbability": 0.352395,
      "nightTempMeanC": 2.328319,
      "nightTempP10C": -2.297907,
      "nightTempP90C": 7.158893,
      "nightWindMeanKmh": 10.559118,
      "highWindHourProbability": 0.005865,
      "dataCompleteness": 1,
      "sampleYearCount": 30
    },
    {
      "month": 2,
      "astronomicalHourCount": 8621,
      "nightCount": 848,
      "clearHourProbability": 0.353555,
      "goodHourProbability": 0.454472,
      "overcastHourProbability": 0.359355,
      "clearNightProbability": 0.429245,
      "goodNightProbability": 0.540094,
      "wetNightHourProbability": 0.079689,
      "dewRiskProbability": 0.312261,
      "nightTempMeanC": 2.692132,
      "nightTempP10C": -1.88663,
      "nightTempP90C": 7.28134,
      "nightWindMeanKmh": 10.391337,
      "highWindHourProbability": 0.007656,
      "dataCompleteness": 1,
      "sampleYearCount": 30
    },
    {
      "month": 3,
      "astronomicalHourCount": 8494,
      "nightCount": 930,
      "clearHourProbability": 0.351425,
      "goodHourProbability": 0.450082,
      "overcastHourProbability": 0.367907,
      "clearNightProbability": 0.412903,
      "goodNightProbability": 0.530108,
      "wetNightHourProbability": 0.087003,
      "dewRiskProbability": 0.301154,
      "nightTempMeanC": 5.093894,
      "nightTempP10C": 0.516677,
      "nightTempP90C": 9.478085,
      "nightWindMeanKmh": 9.390748,
      "highWindHourProbability": 0.005651,
      "dataCompleteness": 1,
      "sampleYearCount": 30
    },
    {
      "month": 4,
      "astronomicalHourCount": 6537,
      "nightCount": 900,
      "clearHourProbability": 0.342512,
      "goodHourProbability": 0.442099,
      "overcastHourProbability": 0.36194,
      "clearNightProbability": 0.372222,
      "goodNightProbability": 0.48,
      "wetNightHourProbability": 0.083525,
      "dewRiskProbability": 0.30488,
      "nightTempMeanC": 6.801599,
      "nightTempP10C": 2.770694,
      "nightTempP90C": 10.613176,
      "nightWindMeanKmh": 8.217136,
      "highWindHourProbability": 0.000765,
      "dataCompleteness": 1,
      "sampleYearCount": 30
    },
    {
      "month": 5,
      "astronomicalHourCount": 5388,
      "nightCount": 930,
      "clearHourProbability": 0.356904,
      "goodHourProbability": 0.47049,
      "overcastHourProbability": 0.345954,
      "clearNightProbability": 0.364516,
      "goodNightProbability": 0.473118,
      "wetNightHourProbability": 0.066258,
      "dewRiskProbability": 0.331663,
      "nightTempMeanC": 10.154974,
      "nightTempP10C": 5.923732,
      "nightTempP90C": 14.098166,
      "nightWindMeanKmh": 6.789793,
      "highWindHourProbability": 0,
      "dataCompleteness": 1,
      "sampleYearCount": 30
    },
    {
      "month": 6,
      "astronomicalHourCount": 4500,
      "nightCount": 900,
      "clearHourProbability": 0.518444,
      "goodHourProbability": 0.644,
      "overcastHourProbability": 0.206222,
      "clearNightProbability": 0.506667,
      "goodNightProbability": 0.623333,
      "wetNightHourProbability": 0.049778,
      "dewRiskProbability": 0.253556,
      "nightTempMeanC": 14.577174,
      "nightTempP10C": 10.466777,
      "nightTempP90C": 18.319436,
      "nightWindMeanKmh": 5.450022,
      "highWindHourProbability": 0,
      "dataCompleteness": 1,
      "sampleYearCount": 30
    },
    {
      "month": 7,
      "astronomicalHourCount": 4946,
      "nightCount": 930,
      "clearHourProbability": 0.647594,
      "goodHourProbability": 0.750101,
      "overcastHourProbability": 0.121715,
      "clearNightProbability": 0.644086,
      "goodNightProbability": 0.741935,
      "wetNightHourProbability": 0.029114,
      "dewRiskProbability": 0.287505,
      "nightTempMeanC": 17.475445,
      "nightTempP10C": 14.533875,
      "nightTempP90C": 20.2669,
      "nightWindMeanKmh": 4.929408,
      "highWindHourProbability": 0,
      "dataCompleteness": 1,
      "sampleYearCount": 30
    },
    {
      "month": 8,
      "astronomicalHourCount": 6377,
      "nightCount": 930,
      "clearHourProbability": 0.494276,
      "goodHourProbability": 0.597146,
      "overcastHourProbability": 0.249804,
      "clearNightProbability": 0.529032,
      "goodNightProbability": 0.627957,
      "wetNightHourProbability": 0.048142,
      "dewRiskProbability": 0.397366,
      "nightTempMeanC": 17.554859,
      "nightTempP10C": 14.488836,
      "nightTempP90C": 20.413758,
      "nightWindMeanKmh": 5.056952,
      "highWindHourProbability": 0,
      "dataCompleteness": 1,
      "sampleYearCount": 30
    },
    {
      "month": 9,
      "astronomicalHourCount": 7827,
      "nightCount": 900,
      "clearHourProbability": 0.338699,
      "goodHourProbability": 0.442698,
      "overcastHourProbability": 0.378434,
      "clearNightProbability": 0.394444,
      "goodNightProbability": 0.497778,
      "wetNightHourProbability": 0.06452,
      "dewRiskProbability": 0.469912,
      "nightTempMeanC": 13.955283,
      "nightTempP10C": 9.643468,
      "nightTempP90C": 17.77518,
      "nightWindMeanKmh": 6.145832,
      "highWindHourProbability": 0,
      "dataCompleteness": 1,
      "sampleYearCount": 30
    },
    {
      "month": 10,
      "astronomicalHourCount": 9028,
      "nightCount": 930,
      "clearHourProbability": 0.321112,
      "goodHourProbability": 0.408839,
      "overcastHourProbability": 0.423903,
      "clearNightProbability": 0.396774,
      "goodNightProbability": 0.494624,
      "wetNightHourProbability": 0.084183,
      "dewRiskProbability": 0.437306,
      "nightTempMeanC": 10.294617,
      "nightTempP10C": 5.757216,
      "nightTempP90C": 14.519973,
      "nightWindMeanKmh": 7.66982,
      "highWindHourProbability": 0.000332,
      "dataCompleteness": 1,
      "sampleYearCount": 30
    },
    {
      "month": 11,
      "astronomicalHourCount": 9900,
      "nightCount": 900,
      "clearHourProbability": 0.296768,
      "goodHourProbability": 0.392424,
      "overcastHourProbability": 0.41404,
      "clearNightProbability": 0.38,
      "goodNightProbability": 0.491111,
      "wetNightHourProbability": 0.084242,
      "dewRiskProbability": 0.390606,
      "nightTempMeanC": 5.442318,
      "nightTempP10C": 0.425858,
      "nightTempP90C": 10.19424,
      "nightWindMeanKmh": 9.993157,
      "highWindHourProbability": 0.003131,
      "dataCompleteness": 1,
      "sampleYearCount": 30
    },
    {
      "month": 12,
      "astronomicalHourCount": 10230,
      "nightCount": 930,
      "clearHourProbability": 0.293353,
      "goodHourProbability": 0.376246,
      "overcastHourProbability": 0.445846,
      "clearNightProbability": 0.384946,
      "goodNightProbability": 0.472043,
      "wetNightHourProbability": 0.079961,
      "dewRiskProbability": 0.391202,
      "nightTempMeanC": 2.975581,
      "nightTempP10C": -1.758402,
      "nightTempP90C": 7.551641,
      "nightWindMeanKmh": 10.348324,
      "highWindHourProbability": 0.008895,
      "dataCompleteness": 1,
      "sampleYearCount": 30
    }
  ]
}
