{
  "siteId": "stóg-izerski",
  "source": "era5-single-levels-timeseries",
  "climateNormal": {
    "startYear": 1991,
    "endYear": 2020
  },
  "requestedPoint": [
    50.9,
    15.31
  ],
  "gridPoint": [
    51,
    15.25
  ],
  "gridDistanceKm": 11.887,
  "retrievedAt": "2026-09-17T11:30:55.661812Z",
  "precipitationConvention": "hourly-accumulation-ending-at-valid-time-metres-to-mm",
  "months": [
    {
      "month": 1,
      "astronomicalHourCount": 10277,
      "nightCount": 930,
      "clearHourProbability": 0.139535,
      "goodHourProbability": 0.203756,
      "overcastHourProbability": 0.617593,
      "clearNightProbability": 0.188172,
      "goodNightProbability": 0.265591,
      "wetNightHourProbability": 0.254062,
      "dewRiskProbability": 0.658266,
      "nightTempMeanC": -1.85559,
      "nightTempP10C": -9.62424,
      "nightTempP90C": 4.614968,
      "nightWindMeanKmh": 14.232284,
      "highWindHourProbability": 0.031429,
      "dataCompleteness": 1,
      "sampleYearCount": 30
    },
    {
      "month": 2,
      "astronomicalHourCount": 8714,
      "nightCount": 848,
      "clearHourProbability": 0.155726,
      "goodHourProbability": 0.227565,
      "overcastHourProbability": 0.586872,
      "clearNightProbability": 0.214623,
      "goodNightProbability": 0.303066,
      "wetNightHourProbability": 0.229401,
      "dewRiskProbability": 0.570576,
      "nightTempMeanC": -1.109307,
      "nightTempP10C": -8.315768,
      "nightTempP90C": 5.069451,
      "nightWindMeanKmh": 13.105412,
      "highWindHourProbability": 0.013771,
      "dataCompleteness": 1,
      "sampleYearCount": 30
    },
    {
      "month": 3,
      "astronomicalHourCount": 7710,
      "nightCount": 930,
      "clearHourProbability": 0.200908,
      "goodHourProbability": 0.289364,
      "overcastHourProbability": 0.527626,
      "clearNightProbability": 0.237634,
      "goodNightProbability": 0.345161,
      "wetNightHourProbability": 0.220363,
      "dewRiskProbability": 0.484565,
      "nightTempMeanC": 1.655925,
      "nightTempP10C": -3.714942,
      "nightTempP90C": 6.933212,
      "nightWindMeanKmh": 11.926215,
      "highWindHourProbability": 0.012322,
      "dataCompleteness": 1,
      "sampleYearCount": 30
    },
    {
      "month": 4,
      "astronomicalHourCount": 5317,
      "nightCount": 900,
      "clearHourProbability": 0.288697,
      "goodHourProbability": 0.397216,
      "overcastHourProbability": 0.393079,
      "clearNightProbability": 0.281111,
      "goodNightProbability": 0.392222,
      "wetNightHourProbability": 0.12808,
      "dewRiskProbability": 0.345119,
      "nightTempMeanC": 5.693102,
      "nightTempP10C": 0.17643,
      "nightTempP90C": 11.02912,
      "nightWindMeanKmh": 9.922302,
      "highWindHourProbability": 0.002821,
      "dataCompleteness": 1,
      "sampleYearCount": 30
    },
    {
      "month": 5,
      "astronomicalHourCount": 2040,
      "nightCount": 738,
      "clearHourProbability": 0.272059,
      "goodHourProbability": 0.37451,
      "overcastHourProbability": 0.459804,
      "clearNightProbability": 0.149051,
      "goodNightProbability": 0.226287,
      "wetNightHourProbability": 0.143137,
      "dewRiskProbability": 0.422549,
      "nightTempMeanC": 9.058222,
      "nightTempP10C": 4.334775,
      "nightTempP90C": 13.65217,
      "nightWindMeanKmh": 9.135379,
      "highWindHourProbability": 0,
      "dataCompleteness": 1,
      "sampleYearCount": 30
    },
    {
      "month": 6,
      "astronomicalHourCount": 0,
      "nightCount": 0,
      "clearHourProbability": null,
      "goodHourProbability": null,
      "overcastHourProbability": null,
      "clearNightProbability": null,
      "goodNightProbability": null,
      "wetNightHourProbability": null,
      "dewRiskProbability": null,
      "nightTempMeanC": null,
      "nightTempP10C": null,
      "nightTempP90C": null,
      "nightWindMeanKmh": null,
      "highWindHourProbability": null,
      "dataCompleteness": 1,
      "sampleYearCount": 0
    },
    {
      "month": 7,
      "astronomicalHourCount": 936,
      "nightCount": 439,
      "clearHourProbability": 0.25641,
      "goodHourProbability": 0.386752,
      "overcastHourProbability": 0.402778,
      "clearNightProbability": 0.095672,
      "goodNightProbability": 0.157175,
      "wetNightHourProbability": 0.130342,
      "dewRiskProbability": 0.434829,
      "nightTempMeanC": 15.256175,
      "nightTempP10C": 11.72839,
      "nightTempP90C": 18.96715,
      "nightWindMeanKmh": 8.282814,
      "highWindHourProbability": 0,
      "dataCompleteness": 1,
      "sampleYearCount": 30
    },
    {
      "month": 8,
      "astronomicalHourCount": 4494,
      "nightCount": 930,
      "clearHourProbability": 0.278149,
      "goodHourProbability": 0.410325,
      "overcastHourProbability": 0.385403,
      "clearNightProbability": 0.247312,
      "goodNightProbability": 0.376344,
      "wetNightHourProbability": 0.129061,
      "dewRiskProbability": 0.470182,
      "nightTempMeanC": 14.308045,
      "nightTempP10C": 9.945574,
      "nightTempP90C": 18.397653,
      "nightWindMeanKmh": 8.428203,
      "highWindHourProbability": 0.000223,
      "dataCompleteness": 1,
      "sampleYearCount": 30
    },
    {
      "month": 9,
      "astronomicalHourCount": 6837,
      "nightCount": 900,
      "clearHourProbability": 0.252304,
      "goodHourProbability": 0.364926,
      "overcastHourProbability": 0.436888,
      "clearNightProbability": 0.284444,
      "goodNightProbability": 0.4,
      "wetNightHourProbability": 0.138657,
      "dewRiskProbability": 0.601872,
      "nightTempMeanC": 10.747175,
      "nightTempP10C": 6.2484,
      "nightTempP90C": 15.200268,
      "nightWindMeanKmh": 9.763874,
      "highWindHourProbability": 0.001755,
      "dataCompleteness": 1,
      "sampleYearCount": 30
    },
    {
      "month": 10,
      "astronomicalHourCount": 8922,
      "nightCount": 930,
      "clearHourProbability": 0.203766,
      "goodHourProbability": 0.29388,
      "overcastHourProbability": 0.521296,
      "clearNightProbability": 0.25914,
      "goodNightProbability": 0.370968,
      "wetNightHourProbability": 0.170365,
      "dewRiskProbability": 0.664425,
      "nightTempMeanC": 6.889675,
      "nightTempP10C": 1.071918,
      "nightTempP90C": 12.210386,
      "nightWindMeanKmh": 11.685972,
      "highWindHourProbability": 0.00538,
      "dataCompleteness": 1,
      "sampleYearCount": 30
    },
    {
      "month": 11,
      "astronomicalHourCount": 10113,
      "nightCount": 900,
      "clearHourProbability": 0.11154,
      "goodHourProbability": 0.180263,
      "overcastHourProbability": 0.626916,
      "clearNightProbability": 0.167778,
      "goodNightProbability": 0.268889,
      "wetNightHourProbability": 0.196678,
      "dewRiskProbability": 0.758825,
      "nightTempMeanC": 2.780549,
      "nightTempP10C": -2.479384,
      "nightTempP90C": 8.20064,
      "nightWindMeanKmh": 12.492163,
      "highWindHourProbability": 0.006427,
      "dataCompleteness": 1,
      "sampleYearCount": 30
    },
    {
      "month": 12,
      "astronomicalHourCount": 10996,
      "nightCount": 930,
      "clearHourProbability": 0.117134,
      "goodHourProbability": 0.185977,
      "overcastHourProbability": 0.644507,
      "clearNightProbability": 0.168817,
      "goodNightProbability": 0.267742,
      "wetNightHourProbability": 0.247817,
      "dewRiskProbability": 0.687614,
      "nightTempMeanC": -0.475001,
      "nightTempP10C": -6.951945,
      "nightTempP90C": 5.16598,
      "nightWindMeanKmh": 14.212504,
      "highWindHourProbability": 0.02319,
      "dataCompleteness": 1,
      "sampleYearCount": 30
    }
  ]
}
